thread_id,timestamp,user_query,response
1,00:09:00,"show me the airline policy

","It seems that there is still no specific information available regarding the airline policy. If you have a particular question or need details about a specific aspect of the airline's policies (like baggage, cancellations, or refunds), please let me know, and I'll do my best to assist you!"
1,00:09:32,show me the airline policy,"Here are the key points regarding Swiss Airlines' cancellation policy:

1. **Refunds**: If you cancel your flight, you may be eligible for a refund, but it could be partial depending on the fare type and timing of the cancellation. If booked through a third-party website or travel agent, you may need to contact them directly.

2. **24-Hour Cancellation Policy**: Swiss Airlines has a 24-hour cancellation policy, allowing you to cancel your flight within 24 hours of booking without penalty, provided the flight is at least 7 days away.

3. **Unforeseen Circumstances**: If you need to cancel due to unforeseen circumstances (e.g., medical emergencies, natural disasters), Swiss Airlines may offer special exemptions or accommodations.

4. **Cancellation Process**: You can cancel your flight online, through the mobile app, or by contacting customer service. To cancel online:
   - Visit the Swiss Air website or app and go to the ""My Bookings"" section.
   - Log in with your booking details.
   - Find the flight you want to cancel and click the ""Cancel"" button.
   - Follow the prompts to confirm your cancellation and review any applicable fees.

5. **Customer Service**: If you prefer to cancel via customer service, you can contact them through phone, email, or live chat. Have your booking details ready, as cancellation fees may apply based on your ticket type.

6. **Compensation for Delays**: In cases of delays due to bad weather or political unrest, Swiss Airlines may not be obligated to offer compensation.

It's important to familiarize yourself with the terms and conditions of your ticket to avoid unnecessary fees or charges."
1,00:16:08,show me the airline policy,"Here are the key points regarding Swiss Airlines' cancellation policy:

1. **Cancellation Process**: You can cancel your flight online, through the mobile app, or by contacting Swiss Air Customer Service. To cancel online, log in to your account, navigate to ""My Bookings,"" select the flight, and follow the prompts.

2. **Refunds**: Depending on your fare type and the timing of your cancellation, you may be eligible for a refund or a partial refund. If you booked through a third-party website, you may need to contact them directly.

3. **24-Hour Cancellation Policy**: Swiss Airlines has a 24-hour cancellation policy, which may allow you to cancel your flight without penalty if done within 24 hours of booking.

4. **Special Exemptions**: If you need to cancel due to unforeseen circumstances (e.g., medical emergencies, natural disasters), Swiss Air may offer special exemptions or accommodations.

5. **Fees and Penalties**: Cancellation fees may apply based on your ticket type and the timing of your cancellation. It's important to review the terms and conditions of your ticket.

6. **Customer Service**: If you prefer to cancel via phone or email, have your booking details ready when contacting Swiss Air Customer Service.

For more detailed information, you may want to check the official Swiss Airlines website or contact their customer service directly."
